{
  "$ref": "#/definitions/works",
  "definitions": {
    "works": {
      "type": "object",
      "properties": {
        "id": {
          "type": "number"
        },
        "workName": {
          "type": "string"
        },
        "competences": {
          "type": "array",
          "items": {
            "type": "string"
          }
        },
        "photo": {
          "type": "string"
        },
        "date": {
          "type": "string"
        },
        "$schema": {
          "type": "string"
        }
      },
      "required": [
        "id",
        "workName",
        "competences",
        "photo",
        "date"
      ],
      "additionalProperties": false
    }
  },
  "$schema": "http://json-schema.org/draft-07/schema#"
}